{
  "schemaVersion": "0.1.0",
  "kind": "asset",
  "id": "io.github.theboyyss.examplemod.assets",
  "assets": [
    {
      "id": "io.github.theboyyss.examplemod.assets.config.settings",
      "assetType": "config",
      "source": "src/assets/config/settings.json",
      "target": "config/ExampleMod/settings.json",
      "required": true,
      "tags": [
        "synthetic"
      ]
    },
    {
      "id": "io.github.theboyyss.examplemod.assets.texture.mcm.logo",
      "assetType": "texture",
      "source": "src/assets/textures/interface/logo.dds",
      "target": "textures/interface/ExampleMod/Logo.dds",
      "required": true,
      "tags": [
        "synthetic",
        "mcm"
      ]
    },
    {
      "id": "io.github.theboyyss.examplemod.assets.voice.intro.hello.wav",
      "assetType": "voice",
      "source": "src/assets/voice/intro_hello.wav",
      "target": "sound/voice/ExampleMod.esm/ExampleVoice/intro_hello.wav",
      "required": true,
      "tags": [
        "synthetic"
      ]
    },
    {
      "id": "io.github.theboyyss.examplemod.assets.voice.intro.hello.ogg",
      "assetType": "voice",
      "source": "src/assets/voice/intro_hello.ogg",
      "target": "sound/voice/ExampleMod.esm/ExampleVoice/intro_hello.ogg",
      "required": true,
      "tags": [
        "synthetic"
      ]
    },
    {
      "id": "io.github.theboyyss.examplemod.assets.lip.intro.hello",
      "assetType": "lip",
      "source": "src/assets/voice/intro_hello.lip",
      "target": "sound/voice/ExampleMod.esm/ExampleVoice/intro_hello.lip",
      "required": true,
      "tags": [
        "synthetic"
      ]
    }
  ]
}
